{
  "datasetVersion": "1.0.0-rc.1",
  "lifecycle": "PROPOSED",
  "runtimeAuthority": false,
  "description": "Synthetic and sanitized S2-03 dataset for deterministic contract, semantic-invariant and future provider-evaluation slices. It is not production ground truth.",
  "versions": {
    "contractVersion": "2.0",
    "contextSchemaVersion": "RRC-1.0.0-rc.1",
    "evidenceEnvelopeVersion": "1.0.0-rc.1",
    "policyVersion": "PF-2.0.0-proposed.1",
    "ruleCatalogVersion": "RC-2.0.0-proposed.2",
    "ruleVersion": "1.0.0-proposed.2",
    "promptVersion": "report-ai-v2-sprint2.2",
    "runtimeRequestSchemaId": "https://cafestory.local/contracts/admin-report-ai-runtime-request-s2.schema.json",
    "providerOutputSchemaId": "https://cafestory.local/contracts/admin-report-ai-provider-output-s2.schema.json",
    "rubricVersion": "1.0.0-rc.1"
  },
  "evidenceBundles": [
    {
      "bundleId": "EVB-TEXT-SUFFICIENT",
      "targetTypes": ["BLOG", "COMMENT"],
      "collectionState": "AVAILABLE_COMPLETE",
      "envelopeVersion": "1.0.0-rc.1",
      "snapshotBinding": "MATCHED",
      "includesRequiredKinds": true,
      "items": [
        {"evidenceId": "EV-TARGET-IDENTITY", "evidenceKind": "TARGET_IDENTITY", "availability": "AVAILABLE", "quality": "HIGH", "sourceType": "TARGET_SNAPSHOT", "intendedUse": "CONTEXT_ONLY", "payloadMode": "INLINE_SANITIZED"},
        {"evidenceId": "EV-TARGET-STATE", "evidenceKind": "TARGET_STATE", "availability": "AVAILABLE", "quality": "HIGH", "sourceType": "TARGET_SNAPSHOT", "intendedUse": "CONTEXT_ONLY", "payloadMode": "INLINE_SANITIZED"},
        {"evidenceId": "EV-TARGET-TEXT", "evidenceKind": "TARGET_TEXT_CONTENT", "availability": "AVAILABLE", "quality": "HIGH", "sourceType": "TARGET_SNAPSHOT", "intendedUse": "RULE_EVALUATION_CANDIDATE", "payloadMode": "INLINE_SANITIZED"}
      ]
    },
    {
      "bundleId": "EVB-COMMENT-PARENT-SUFFICIENT",
      "targetTypes": ["COMMENT"],
      "collectionState": "AVAILABLE_COMPLETE",
      "envelopeVersion": "1.0.0-rc.1",
      "snapshotBinding": "MATCHED",
      "includesRequiredKinds": true,
      "items": [
        {"evidenceId": "EV-COMMENT-IDENTITY", "evidenceKind": "TARGET_IDENTITY", "availability": "AVAILABLE", "quality": "HIGH", "sourceType": "TARGET_SNAPSHOT", "intendedUse": "CONTEXT_ONLY", "payloadMode": "INLINE_SANITIZED"},
        {"evidenceId": "EV-COMMENT-STATE", "evidenceKind": "TARGET_STATE", "availability": "AVAILABLE", "quality": "HIGH", "sourceType": "TARGET_SNAPSHOT", "intendedUse": "CONTEXT_ONLY", "payloadMode": "INLINE_SANITIZED"},
        {"evidenceId": "EV-COMMENT-TEXT", "evidenceKind": "TARGET_TEXT_CONTENT", "availability": "AVAILABLE", "quality": "HIGH", "sourceType": "TARGET_SNAPSHOT", "intendedUse": "RULE_EVALUATION_CANDIDATE", "payloadMode": "INLINE_SANITIZED"},
        {"evidenceId": "EV-PARENT-BLOG", "evidenceKind": "PARENT_BLOG_CONTEXT", "availability": "AVAILABLE", "quality": "MEDIUM", "sourceType": "PLATFORM_RECORD", "intendedUse": "RULE_EVALUATION_CANDIDATE", "payloadMode": "INLINE_SANITIZED"}
      ]
    },
    {
      "bundleId": "EVB-TEXT-INSUFFICIENT",
      "targetTypes": ["BLOG", "COMMENT"],
      "collectionState": "MISSING_REQUIRED_KIND",
      "envelopeVersion": "1.0.0-rc.1",
      "snapshotBinding": "MATCHED",
      "includesRequiredKinds": false,
      "items": [
        {"evidenceId": "EV-TARGET-IDENTITY", "evidenceKind": "TARGET_IDENTITY", "availability": "AVAILABLE", "quality": "HIGH", "sourceType": "TARGET_SNAPSHOT", "intendedUse": "CONTEXT_ONLY", "payloadMode": "INLINE_SANITIZED"},
        {"evidenceId": "EV-TARGET-STATE", "evidenceKind": "TARGET_STATE", "availability": "AVAILABLE", "quality": "HIGH", "sourceType": "TARGET_SNAPSHOT", "intendedUse": "CONTEXT_ONLY", "payloadMode": "INLINE_SANITIZED"},
        {"evidenceId": "EV-TARGET-TEXT-MISSING", "evidenceKind": "TARGET_TEXT_CONTENT", "availability": "MISSING", "quality": "UNUSABLE", "sourceType": "TARGET_SNAPSHOT", "intendedUse": "RULE_EVALUATION_CANDIDATE", "payloadMode": "NONE"}
      ]
    },
    {
      "bundleId": "EVB-COMMENT-PARENT-MISSING",
      "targetTypes": ["COMMENT"],
      "collectionState": "MISSING_REQUIRED_KIND",
      "envelopeVersion": "1.0.0-rc.1",
      "snapshotBinding": "MATCHED",
      "includesRequiredKinds": true,
      "items": [
        {"evidenceId": "EV-COMMENT-IDENTITY", "evidenceKind": "TARGET_IDENTITY", "availability": "AVAILABLE", "quality": "HIGH", "sourceType": "TARGET_SNAPSHOT", "intendedUse": "CONTEXT_ONLY", "payloadMode": "INLINE_SANITIZED"},
        {"evidenceId": "EV-COMMENT-STATE", "evidenceKind": "TARGET_STATE", "availability": "AVAILABLE", "quality": "HIGH", "sourceType": "TARGET_SNAPSHOT", "intendedUse": "CONTEXT_ONLY", "payloadMode": "INLINE_SANITIZED"},
        {"evidenceId": "EV-COMMENT-TEXT", "evidenceKind": "TARGET_TEXT_CONTENT", "availability": "AVAILABLE", "quality": "HIGH", "sourceType": "TARGET_SNAPSHOT", "intendedUse": "RULE_EVALUATION_CANDIDATE", "payloadMode": "INLINE_SANITIZED"},
        {"evidenceId": "EV-PARENT-BLOG-MISSING", "evidenceKind": "PARENT_BLOG_CONTEXT", "availability": "MISSING", "quality": "UNUSABLE", "sourceType": "PLATFORM_RECORD", "intendedUse": "RULE_EVALUATION_CANDIDATE", "payloadMode": "NONE"}
      ]
    },
    {
      "bundleId": "EVB-TEXT-CONFLICTED",
      "targetTypes": ["BLOG", "COMMENT"],
      "collectionState": "CONFLICTING_MATERIAL",
      "envelopeVersion": "1.0.0-rc.1",
      "snapshotBinding": "MATCHED",
      "includesRequiredKinds": true,
      "items": [
        {"evidenceId": "EV-TARGET-IDENTITY", "evidenceKind": "TARGET_IDENTITY", "availability": "AVAILABLE", "quality": "HIGH", "sourceType": "TARGET_SNAPSHOT", "intendedUse": "CONTEXT_ONLY", "payloadMode": "INLINE_SANITIZED"},
        {"evidenceId": "EV-TARGET-STATE", "evidenceKind": "TARGET_STATE", "availability": "AVAILABLE", "quality": "HIGH", "sourceType": "TARGET_SNAPSHOT", "intendedUse": "CONTEXT_ONLY", "payloadMode": "INLINE_SANITIZED"},
        {"evidenceId": "EV-TARGET-TEXT", "evidenceKind": "TARGET_TEXT_CONTENT", "availability": "AVAILABLE", "quality": "HIGH", "sourceType": "TARGET_SNAPSHOT", "intendedUse": "RULE_EVALUATION_CANDIDATE", "payloadMode": "INLINE_SANITIZED"},
        {"evidenceId": "EV-COUNTER-CONTEXT", "evidenceKind": "PARENT_BLOG_CONTEXT", "availability": "AVAILABLE", "quality": "MEDIUM", "sourceType": "PLATFORM_RECORD", "intendedUse": "COUNTER_EVIDENCE_CANDIDATE", "payloadMode": "INLINE_SANITIZED"}
      ]
    },
    {
      "bundleId": "EVB-MEDIA-UNASSESSABLE",
      "targetTypes": ["BLOG", "COMMENT"],
      "collectionState": "UNASSESSABLE_SOURCE",
      "envelopeVersion": "1.0.0-rc.1",
      "snapshotBinding": "MATCHED",
      "includesRequiredKinds": true,
      "items": [
        {"evidenceId": "EV-TARGET-IDENTITY", "evidenceKind": "TARGET_IDENTITY", "availability": "AVAILABLE", "quality": "HIGH", "sourceType": "TARGET_SNAPSHOT", "intendedUse": "CONTEXT_ONLY", "payloadMode": "INLINE_SANITIZED"},
        {"evidenceId": "EV-TARGET-STATE", "evidenceKind": "TARGET_STATE", "availability": "AVAILABLE", "quality": "HIGH", "sourceType": "TARGET_SNAPSHOT", "intendedUse": "CONTEXT_ONLY", "payloadMode": "INLINE_SANITIZED"},
        {"evidenceId": "EV-MEDIA-REFERENCE", "evidenceKind": "TARGET_MEDIA_REFERENCE", "availability": "NOT_COLLECTED", "quality": "UNUSABLE", "sourceType": "TARGET_SNAPSHOT", "intendedUse": "CONTEXT_ONLY", "payloadMode": "REFERENCE_ONLY"}
      ]
    },
    {
      "bundleId": "EVB-REPORTER-ONLY",
      "targetTypes": ["BLOG", "COMMENT"],
      "collectionState": "UNASSESSABLE_SOURCE",
      "envelopeVersion": "1.0.0-rc.1",
      "snapshotBinding": "MATCHED",
      "includesRequiredKinds": true,
      "items": [
        {"evidenceId": "EV-TARGET-IDENTITY", "evidenceKind": "TARGET_IDENTITY", "availability": "AVAILABLE", "quality": "HIGH", "sourceType": "TARGET_SNAPSHOT", "intendedUse": "CONTEXT_ONLY", "payloadMode": "INLINE_SANITIZED"},
        {"evidenceId": "EV-TARGET-STATE", "evidenceKind": "TARGET_STATE", "availability": "AVAILABLE", "quality": "HIGH", "sourceType": "TARGET_SNAPSHOT", "intendedUse": "CONTEXT_ONLY", "payloadMode": "INLINE_SANITIZED"},
        {"evidenceId": "EV-REPORTER-TEXT", "evidenceKind": "TARGET_TEXT_CONTENT", "availability": "AVAILABLE", "quality": "LOW", "sourceType": "REPORTER_CLAIM", "intendedUse": "RULE_EVALUATION_CANDIDATE", "payloadMode": "INLINE_SANITIZED"}
      ]
    },
    {
      "bundleId": "EVB-DERIVED-ONLY",
      "targetTypes": ["BLOG", "COMMENT"],
      "collectionState": "UNASSESSABLE_SOURCE",
      "envelopeVersion": "1.0.0-rc.1",
      "snapshotBinding": "MATCHED",
      "includesRequiredKinds": true,
      "items": [
        {"evidenceId": "EV-TARGET-IDENTITY", "evidenceKind": "TARGET_IDENTITY", "availability": "AVAILABLE", "quality": "HIGH", "sourceType": "TARGET_SNAPSHOT", "intendedUse": "CONTEXT_ONLY", "payloadMode": "INLINE_SANITIZED"},
        {"evidenceId": "EV-TARGET-STATE", "evidenceKind": "TARGET_STATE", "availability": "AVAILABLE", "quality": "HIGH", "sourceType": "TARGET_SNAPSHOT", "intendedUse": "CONTEXT_ONLY", "payloadMode": "INLINE_SANITIZED"},
        {"evidenceId": "EV-PRIOR-AI", "evidenceKind": "TARGET_TEXT_CONTENT", "availability": "AVAILABLE", "quality": "LOW", "sourceType": "DERIVED_SIGNAL", "intendedUse": "RULE_EVALUATION_CANDIDATE", "payloadMode": "INLINE_SANITIZED"}
      ]
    },
    {
      "bundleId": "EVB-STALE-TEXT",
      "targetTypes": ["BLOG", "COMMENT"],
      "collectionState": "UNASSESSABLE_SOURCE",
      "envelopeVersion": "1.0.0-rc.1",
      "snapshotBinding": "STALE",
      "includesRequiredKinds": true,
      "items": [
        {"evidenceId": "EV-TARGET-IDENTITY", "evidenceKind": "TARGET_IDENTITY", "availability": "STALE", "quality": "LOW", "sourceType": "TARGET_SNAPSHOT", "intendedUse": "CONTEXT_ONLY", "payloadMode": "INLINE_SANITIZED"},